<LCPQuestionnaire xmlns:xsi="http://www.w3.org/2001/XMLSchema-instance" xml:lang="en"
                  xsi:noNamespaceSchemaLocation="../schema/LCP-IED.xsd">
    <BasicData>
        <MemberState>DE</MemberState>
        <ReferenceYear>2016</ReferenceYear>
        <NumberOfPlants>605</NumberOfPlants>
        <Organization>Umweltbundesamt</Organization>
        <Address1>Wörlitzer Platz 1</Address1>
        <Address2/>
        <City>Dessau-Roßlau</City>
        <State>DE</State>
        <PostalCode>D-06844</PostalCode>
        <NameOfDepartmentContactPerson>Section Emissions Situation</NameOfDepartmentContactPerson>
        <Phone/>
        <Email>LCP@uba.de</Email>
    </BasicData>
    <ListOfPlants>
        <Plant>
            <PlantName>Erdgasverdichter Sayda</PlantName>
            <PlantId>DE0001</PlantId>
            <EPRTRNationalId>14-60-10525170000</EPRTRNationalId>
            <PlantLocation>
                <City>Berlin test</City>
                <Region>region test</Region>
                <PostalCode>test-12345</PostalCode>
                <CountryCode>DE</CountryCode>
                <BuildingNumber>1</BuildingNumber>
                <StreetName>Berlinstrasse test</StreetName>
            </PlantLocation>
            <GeographicalCoordinate>
                <Longitude>13.43958289</Longitude>
                <Latitude>50.70439968</Latitude>
            </GeographicalCoordinate>
            <FacilityName>FacilityName test</FacilityName>
            <Comments>this is a random comment</Comments>
            <PlantDetails>
                <MWth>545</MWth>
                <DateOfStartOfOperation/>
                <Refineries>true</Refineries>
                <OtherSector>iron_steel</OtherSector>
                <OperatingHours>1111</OperatingHours>
                <Comments>not a random comment</Comments>
                <TypeOfCombustionPlant>DieselEngine</TypeOfCombustionPlant>
                <TypeOfCombustionPlantFurtherDetails>FurtherDetail test</TypeOfCombustionPlantFurtherDetails>
                <Derogation>Art72.4.b</Derogation>
            </PlantDetails>
            <EnergyInputAndTotalEmissionsToAir>
                <EnergyInput>
                    <Biomass>3</Biomass>
                    <OtherSolidFuels>
                        <OtherSolidFuel>
                            <Category>Coke</Category>
                            <Value>4</Value>
                        </OtherSolidFuel>
                        <OtherSolidFuel>
                            <Category>Other</Category>
                            <Value>5</Value>
                        </OtherSolidFuel>
                    </OtherSolidFuels>
                    <LiquidFuels>4</LiquidFuels>
                    <NaturalGas>5</NaturalGas>
                    <OtherGases>
                        <OtherGas>
                            <Category>BlastFurnaceGas</Category>
                            <Value>5</Value>
                        </OtherGas>
                        <OtherGas>
                            <Category>LPG</Category>
                            <Value>6</Value>
                        </OtherGas>
                    </OtherGases>
                    <Coal>1</Coal>
                    <Lignite>1</Lignite>
                    <Peat>1</Peat>
                </EnergyInput>
                <TotalEmissionsToAir>
                    <SO2>0.063</SO2>
                    <NOx>21.865</NOx>
                    <TSP>0.009</TSP>
                </TotalEmissionsToAir>
            </EnergyInputAndTotalEmissionsToAir>
            <Desulphurisation>
                <Months>
                    <Month>
                        <MonthValue>JAN</MonthValue>
                        <DesulphurisationRate>78</DesulphurisationRate>
                        <SulphurContent>76</SulphurContent>
                        <TechnicalJustification/>
                    </Month>
                    <Month>
                        <MonthValue>FEB</MonthValue>
                        <DesulphurisationRate>78</DesulphurisationRate>
                        <SulphurContent>76</SulphurContent>
                        <TechnicalJustification/>
                    </Month>
                </Months>
            </Desulphurisation>
            <UsefulHeat>
                <UsefulHeatProportion>67</UsefulHeatProportion>
            </UsefulHeat>
        </Plant>
        <Plant>
            <PlantName>Erdgasverdichter Sayda</PlantName>
            <PlantId>DE0001</PlantId>
            <EPRTRNationalId>14-60-10525170000</EPRTRNationalId>
            <PlantLocation>
                <City>Berlin test</City>
                <Region>region test</Region>
                <PostalCode>test-12345</PostalCode>
                <CountryCode>DE</CountryCode>
                <BuildingNumber>1</BuildingNumber>
                <StreetName>Berlinstrasse test</StreetName>
            </PlantLocation>
            <GeographicalCoordinate>
                <Longitude>13.43958289</Longitude>
                <Latitude>50.70439968</Latitude>
            </GeographicalCoordinate>
            <FacilityName>FacilityName test</FacilityName>
            <Comments>this is a random comment</Comments>
            <PlantDetails>
                <MWth>545</MWth>
                <DateOfStartOfOperation/>
                <Refineries>true</Refineries>
                <OtherSector>iron_steel</OtherSector>
                <OperatingHours>1111</OperatingHours>
                <Comments>not a random comment</Comments>
                <TypeOfCombustionPlant>DieselEngine</TypeOfCombustionPlant>
                <TypeOfCombustionPlantFurtherDetails>FurtherDetail test</TypeOfCombustionPlantFurtherDetails>
                <Derogation>Art72.4.b</Derogation>
            </PlantDetails>
            <EnergyInputAndTotalEmissionsToAir>
                <EnergyInput>
                    <Biomass>3</Biomass>
                    <OtherSolidFuels>
                        <OtherSolidFuel>
                            <Category>Coke</Category>
                            <Value>4</Value>
                        </OtherSolidFuel>
                        <OtherSolidFuel>
                            <Category>Other</Category>
                            <Value>5</Value>
                        </OtherSolidFuel>
                    </OtherSolidFuels>
                    <LiquidFuels>4</LiquidFuels>
                    <NaturalGas>5</NaturalGas>
                    <OtherGases>
                        <OtherGas>
                            <Category>BlastFurnaceGas</Category>
                            <Value>5</Value>
                        </OtherGas>
                        <OtherGas>
                            <Category>LPG</Category>
                            <Value>6</Value>
                        </OtherGas>
                    </OtherGases>
                    <Coal>1</Coal>
                    <Lignite>1</Lignite>
                    <Peat>1</Peat>
                </EnergyInput>
                <TotalEmissionsToAir>
                    <SO2>0.063</SO2>
                    <NOx>21.865</NOx>
                    <TSP>0.009</TSP>
                </TotalEmissionsToAir>
            </EnergyInputAndTotalEmissionsToAir>
            <Desulphurisation>
                <Months>
                    <Month>
                        <MonthValue>JAN</MonthValue>
                        <DesulphurisationRate>78</DesulphurisationRate>
                        <SulphurContent>76</SulphurContent>
                        <TechnicalJustification/>
                    </Month>
                    <Month>
                        <MonthValue>FEB</MonthValue>
                        <DesulphurisationRate>78</DesulphurisationRate>
                        <SulphurContent>76</SulphurContent>
                        <TechnicalJustification/>
                    </Month>
                </Months>
            </Desulphurisation>
            <UsefulHeat>
                <UsefulHeatProportion>67</UsefulHeatProportion>
            </UsefulHeat>
        </Plant>
    </ListOfPlants>
</LCPQuestionnaire>